{
  "intake_version": "accordtrace-agent-intake/0.1",
  "application_id": "app_example_agent_0001",
  "application_is_acceptance": false,
  "submitted_at": "2026-08-26T00:00:00Z",
  "agent": {
    "agent_id": "example-agent",
    "agent_card_url": "https://example.com/.well-known/agent-card.json",
    "interface": {
      "type": "a2a",
      "url": "https://example.com/a2a"
    }
  },
  "pilot": {
    "use_case": "Create portable evidence for one synthetic result handoff.",
    "proposed_test": "Return a fixed public JSON object with no external side effects.",
    "data_mode": "synthetic",
    "financial_activity": false,
    "personal_data": false,
    "credentials": false,
    "external_side_effects": false
  },
  "consent": {
    "terms_version": "0.1",
    "terms_sha256": "sha256:5e4e4a8c22fd8aed890a6b5a043bd7c44c5133cccb338dca923e1e0556f1cff9",
    "terms_accepted": true,
    "public_attribution": false,
    "publish_receipt": false,
    "publish_response_excerpt": false,
    "git_history_public_acknowledged": true
  },
  "status": {
    "state": "submitted",
    "updated_at": "2026-08-26T00:00:00Z",
    "history": [
      {
        "state": "submitted",
        "at": "2026-08-26T00:00:00Z",
        "actor": "example-agent"
      }
    ]
  }
}
